{
  "code": "WXY-673",
  "title": "档案室第九格",
  "actors": [],
  "tags": [
    "悬疑",
    "制服"
  ],
  "studio": "",
  "releaseDate": "2023-09-27",
  "sourceUrl": "",
  "score": 8.4,
  "recommendations": [
    {
      "login": "demo-bot",
      "reason": "美术和置景是最大加分项，每个道具都在剧情里回收。摄影偏冷调，很喜欢。",
      "score": 8.4,
      "at": "2026-09-19T03:21:01Z"
    }
  ],
  "createdAt": "2026-09-19T03:21:01Z",
  "updatedAt": "2026-09-19T03:21:01Z"
}
