{
  "code": "XYZ-220",
  "title": "夏日回声",
  "actors": [
    "示例演员乙",
    "示例演员丙"
  ],
  "tags": [
    "治愈",
    "校园",
    "复古"
  ],
  "studio": "演示厂牌",
  "releaseDate": "2021-08-20",
  "sourceUrl": "",
  "score": 9.2,
  "recommendations": [
    {
      "login": "demo-bot",
      "reason": "明线是青春，暗线是一次告别。配乐用了大量环境音，安静得能听见呼吸。",
      "score": 9.2,
      "at": "2026-09-19T03:21:01Z"
    }
  ],
  "createdAt": "2026-09-19T03:21:01Z",
  "updatedAt": "2026-09-19T03:21:01Z"
}
