{
  "code": "DEF-784",
  "title": "逆光而行",
  "actors": [
    "示例演员戊"
  ],
  "tags": [
    "剧情",
    "高颜值"
  ],
  "studio": "",
  "releaseDate": "2019-05-30",
  "sourceUrl": "",
  "score": 6.9,
  "recommendations": [
    {
      "login": "demo-bot",
      "reason": "剧本一般，但演员撑住了。只想看表演的话值得，冲剧情去的会失望。",
      "score": 6.9,
      "at": "2026-09-19T03:21:01Z"
    }
  ],
  "createdAt": "2026-09-19T03:21:01Z",
  "updatedAt": "2026-09-19T03:21:01Z"
}
