{
  "code": "MNO-338",
  "title": "第七次走廊",
  "actors": [],
  "tags": [
    "悬疑",
    "都市"
  ],
  "studio": "",
  "releaseDate": "2022-11-03",
  "sourceUrl": "",
  "score": 7.8,
  "recommendations": [
    {
      "login": "demo-bot",
      "reason": "循环叙事但没玩概念，每一轮都在补细节。喜欢烧脑但讨厌故弄玄虚的可以看。",
      "score": 7.8,
      "at": "2026-09-19T03:21:01Z"
    }
  ],
  "createdAt": "2026-09-19T03:21:01Z",
  "updatedAt": "2026-09-19T03:21:01Z"
}
