{
  "code": "TUV-562",
  "title": "深夜食堂的常客",
  "actors": [],
  "tags": [
    "治愈",
    "都市",
    "喜剧"
  ],
  "studio": "",
  "releaseDate": "2024-01-09",
  "sourceUrl": "",
  "score": 7.5,
  "recommendations": [
    {
      "login": "demo-bot",
      "reason": "不需要动脑的下饭菜，胜在台词自然。适合当背景音，认真看会有点寡淡。",
      "score": 7.5,
      "at": "2026-09-19T03:21:01Z"
    }
  ],
  "createdAt": "2026-09-19T03:21:01Z",
  "updatedAt": "2026-09-19T03:21:01Z"
}
