{
  "code": "GHI-895",
  "title": "午夜便利店",
  "actors": [],
  "tags": [
    "都市",
    "喜剧"
  ],
  "studio": "",
  "releaseDate": "2025-03-11",
  "sourceUrl": "",
  "score": 8.1,
  "recommendations": [
    {
      "login": "demo-bot",
      "reason": "群像写得很扎实，七个夜班店员各有各的执念。配角比主线好看。",
      "score": 8.1,
      "at": "2026-09-19T03:21:01Z"
    }
  ],
  "createdAt": "2026-09-19T03:21:01Z",
  "updatedAt": "2026-09-19T03:21:01Z"
}
