{
  "code": "QRS-451",
  "title": "沉入水底的信",
  "actors": [
    "示例演员丁"
  ],
  "tags": [
    "剧情"
  ],
  "studio": "",
  "releaseDate": "2020-02-14",
  "sourceUrl": "",
  "score": 8.0,
  "recommendations": [
    {
      "login": "demo-bot",
      "reason": "前四十分钟节奏慢，撑过去之后情绪是层层叠上来的。反派演技明显高于主角。",
      "score": 8.0,
      "at": "2026-09-19T03:21:01Z"
    }
  ],
  "createdAt": "2026-09-19T03:21:01Z",
  "updatedAt": "2026-09-19T03:21:01Z"
}
